video_id,v_pub_datetime,v_total_comments,v_year_views,v_month_views,v_week_views,v_day_views,v_likes,v_dislikes,v_duration,v_cr_click_like_7_days,v_cr_click_dislike_7_days,v_cr_click_vtop_7_days,v_cr_click_long_view_7_days,v_cr_click_comment_7_days,v_cr_click_like_30_days,v_cr_click_dislike_30_days,v_cr_click_vtop_30_days,v_cr_click_long_view_30_days,v_cr_click_comment_30_days,v_cr_click_like_1_days,v_cr_click_dislike_1_days,v_cr_click_vtop_1_days,v_cr_click_long_view_1_days,v_cr_click_comment_1_days,v_is_hidden,v_is_deleted,v_avg_watchtime_1_day,v_avg_watchtime_7_day,v_avg_watchtime_30_day,v_frac_avg_watchtime_1_day_duration,v_frac_avg_watchtime_7_day_duration,v_frac_avg_watchtime_30_day_duration,v_category_popularity_percent_7_days,v_category_popularity_percent_30_days,v_long_views_1_days,v_long_views_7_days,v_long_views_30_days,row_number,title,description,category_id,author_id,title_length
2e5fa099-9b40-4538-87d2-269e004b61ea,2024-07-07 17:30:08+03:00,1,3326851,3325021,31052,7855,15,0,2036.779,0.00966121344840912,0.0,0.0,10.749710163596548,0.0,0.00021052498615798217,0.0,3.007499802256888e-05,0.2134723359641939,3.007499802256888e-05,0.0,0.0,0.0,0.0,0.0,0,0,287.2210057288351,257.59925286616,12.04977111422755,0.14101726585399552,0.12647383582910074,0.005916091590804673,6.561679924597483,4.208400922765609,0,3338,7098,1,Сказочная история Татьяны Моркиной «Мой брат - инопланетянин» | Дремота | Аудиосказка для детей. 0+,"Здравствуйте, маленькие и взрослые любители сказок. Сегодня Наталья Герасимова и Кот Дремота прочтут сказочную историю Татьяны Моркиной «Мой брат - инопланетянин»  Однажды в жизни Евы и её младшего братика Вани наступают невесёлые перемены: малыш вместе с мамой оказывается в больнице. Так проходит много-много дней. Ева часто навещает брата и очень ждёт его дома. Когда же Ваня наконец возвращается, он всё ещё нуждается в помощи. Но Ева точно знает, что ей с братом никогда не будет скучно, ведь он - инопланетянин. Трогательная история о том, что доброты и заботы не бывает слишком много. Если вам понравится эта книга, вы можете купить её в магазинах вашего города, или по ссылке /  Приятного просмотра и добрых снов💜  ⭐ Наше сообщество в ВК ⭐ Наш Яндекс✨Дзен ⭐ Наш канал в Rutube / ⭐ Наш Телеграм-канал: ⭐ И группа в «Одноклассниках»:  Это видео предназначено для засыпания детей и взрослых и может быть использовано в качестве фонового звука для улучшения качества сна. #сказкиДляДетей, #детскиеСказки, #СпокойныйСон, #Расслабление, #ASMR, #звукиПрироды, #звукиДождя, #фоноваяМузыка #Дремота #АудиосказкиДляДетей #Аудиосказка #СказкиНаНочь #Аудиосказки",Детям,fb6ebafa-32b5-4c6a-9a1c-cf23a35810d8,1158
fded1e72-d370-4fe2-aaf2-bbf360793eaa,2024-05-05 10:43:04+03:00,5,38997,3306,1899,529,3646,2,363.734,0.105318588730911,0.0,0.0,53.76513954713007,0.0,0.060496067755595885,0.0,0.0,60.40532365396249,0.0,0.0,0.0,0.0,0.0,0.0,0,0,244.5047258979206,250.13375460768825,249.0384150030248,0.6722075085032485,0.6876831822367122,0.6846718068781714,6.561679924597483,4.208400922765609,0,1021,1997,1,ЧТО ЭТО ЗА Монстр!? Страшный ПОЕЗД-ПАУК Пугает Жителей | CHOO-CHOO CHARLES,"Жители рядом с лесом нам рассказали, что в лесу завёлся Монстр. У него красные глаза, большие щупальца и он издаёт странные звуки. Мы решили проверить так ли это или это просто какой-то зверь. И поняли, что это ПОЕЗД-ПАУК - CHOO-CHOO-CHARLES! Мы вызвали его, чтобы он не пугал жителей.  Окунись в мир страшилок. Приятного просмотра.",Детям,3b2956e3-c9d3-4def-9e9e-37f6ad79bd43,332
95441829-aac5-436d-a04a-9571671bdcb7,2022-12-30 15:36:33+03:00,34,383978,185462,120702,21229,198,7,396.459,0.05136617454557505,0.0,0.008284866862189525,64.03290749117662,0.001656973372437905,0.04906665516386106,0.001078388025579364,0.011862268281373003,69.73989280823025,0.002156776051158728,0.0,0.0,0.0,0.0,0.0,0,0,292.2128691883744,290.7278172689765,294.6162017016963,0.7370569697960555,0.7333111803969048,0.7431189648909378,6.561679924597483,4.208400922765609,0,77289,129341,1,"Маша и Медведь, Первая встреча, 1 серия","Далеко-далеко, в домике возле железной дороги, живет маленькая и очень шустрая девочка Маша. Она так любит играть, что прочие обитатели двора от неё просто прячутся. От скуки непоседа убегает в лес, где находится уютный домик Медведя, который в этот момент как раз ушел на рыбалку. Вернувшись домой, Медведь находит свое жилье в разрушенном состоянии. Он обнаруживает источник беспорядков в самом домике – это прыгающая на кровати маленькая девочка. Медведь всячески пытается избавиться от незваной гостьи. Но когда ему это удается, он вдруг испытывает тревогу за судьбу оставленной в лесу Маши. Медведь бросается на поиски и находит её в своем доме.",Детям,f39f9031-d882-4234-920f-485e899bce90,650
160d0f1c-6187-4269-82bc-b84bcd2917fa,2024-04-18 13:19:09+03:00,14,30392,1424,175,17,3476,2,390.315,0.5714285714285714,0.0,0.0,64.0,0.0,0.1404494382022472,0.0,0.0,62.71067415730337,0.0,0.0,0.0,0.0,0.0,0.0,0,0,267.6470588235294,253.12,248.5498595505618,0.685720658502823,0.6485018510690084,0.6367929993737412,1.4676536231351434,1.711370169212173,0,112,893,1,ОТКДУДА ПОЯВИЛИСЬ МОНСТРЫ? | ЧТО ТАКОЕ РАДИАЦИЯ?,"Что такое радиация? Откуда взялись монстры?  Мы с Егором узнали, что в некоторых местах есть излучения радиации и отправились это проверить. На этих местах мы действительно обнаружили излучения и неожиданно для нас встретили там монстров из Poppy Playtime chsarter 3. CatNap, DogDay, Хаги Ваги, Киси Миси.  Убедитесь и вы в этом сами. Приятного просмотра.  P.S Все персонажи вымышлены, все места придуманы.",Детям,3b2956e3-c9d3-4def-9e9e-37f6ad79bd43,406
59a15306-3753-4845-9fc9-5bf5c147ba96,2024-07-26 13:23:43+03:00,7,41561,41561,23572,4150,2576,3,408.32,2.4690310537926354,0.008484642796538266,2.3799423044289836,49.80061089428135,0.0,6.198118428334256,0.0072183056230600805,5.829984841558192,52.0945116816246,0.0072183056230600805,0.0,0.0,0.0,0.0,0.0,0,0,250.78289156626505,213.0526896317665,180.25138952383244,0.6141822383578199,0.5217787265668262,0.4414463889200442,6.561679924597483,4.208400922765609,0,11739,21651,1,МОРОЖЕНОЕ СВОИМИ РУКАМИ | ФРУКТОВОЕ МОРОЖЕНОЕ БЕЗ СЛИВОК,"ЛЕТО! ЖАРКО! ХОЧЕТСЯ ОСВЕЖИТЬСЯ?  Давайте приготовим мороженое своими руками, что мы и сделали с Егориком. Закупились фруктами, ягодами и попробовали соединить их вместе. Вкусы получились яркие, необычные, а самое главное - это ЛЕГКО ГОТОВИТЬ!  А что ещё для счастья надо?)  Попробуйте и Вы вместе с нами приготовить вкусное фруктовое мороженое без сливок!",Детям,3b2956e3-c9d3-4def-9e9e-37f6ad79bd43,356
fc852636-ce70-4d42-bebe-79700e5ae2e1,2024-04-13 19:53:20+03:00,6,23661,31,2,0,3099,0,283.334,0.0,0.0,0.0,0.0,0.0,0.0,0.0,0.0,74.19354838709677,0.0,0.0,0.0,0.0,0.0,0.0,0,0,0.0,4.5,181.2258064516129,0.0,0.015882315571022185,0.6396189883727788,1.2916749133905727,1.1965122992029273,0,0,23,1,❤️ Делаем настоящую ПИЦЦУ ИЗ ШОКОЛАДА❤️😮,,Детям,f0cb0149-77e9-40cb-b03e-d3862013b472,0
21522906-9d86-46d4-b972-d9f6c915985e,2022-12-23 12:40:31+03:00,3342,2299368,192977,47218,6976,1197,86,0.0,0.06777076538608158,0.0021178364183150494,0.019060527764835446,43.328815282307595,0.0,0.05907439746705566,0.004145571752074082,0.013991304663250024,50.3692149841691,0.0,0.0,0.0,0.0,0.0,0.0,0,0,886.8182339449542,828.8376043034436,820.4220865699021,inf,inf,inf,1.4676536231351434,1.711370169212173,0,20459,97201,1,Прямой эфир Солнце,"Каждый день на RUTUBE идет прямая трансляция развлекательного канала «Солнце». В прямом эфире без остановок показывается детский контент, который подходит для малышей разного возраста, тщательно подобранные анимационные мультфильмы не заставят детей и их родителей скучать. Смотрите в прямом эфире всей семьей такие мультики, как «Фиксики», «Простоквашино», «Буба», «Робин Гуд: проказник из Шервуда», «Плюшевый монстр», а также всеми известный и любимый «Ералаш» на RUTUBE онлайн. Канал «Солнце» отлично подойдет для того, чтобы занять своих детей и скрасить их вечер за просмотром уютных и любимых мультиков.",Детям,fe631d42-4205-44bc-98df-f16731d79afe,609
5ef69052-2c68-4ee4-9c4d-0e78f934f2ce,2024-04-17 15:53:07+03:00,9,25015,8367,1469,111,2865,1,360.167,0.0,0.0,0.0,14.976174268209666,0.0,5.581450938209633,0.0,4.398231146169476,21.441376837576193,0.0,0.0,0.0,0.0,0.0,0.0,0,0,89.52252252252252,49.963921034717494,63.00071710290427,0.2485583702074941,0.13872431687166648,0.17492084811463646,1.1715544716748092,1.0157295263421504,0,220,1794,1,Изучаем ритмику // образовательные видео Valynha,"Приветствую всех, на своем канале! Тут вы потренируете свою фонтазию и внимательность, узнаете больше интересной информации с детским-образовательным контентом! На моем канале вы можете найти больше познавательных видео для вас и ваших детишек. Не забывайте ставить ракеты и подписывайтесь . Так же можешь найти меня тут: Yappy: Valynha instagram: Valynha  email  Спасибо за ваш лайк!",Детям,f47e35ee-e1fb-4062-924d-076eec203b3f,384
f5b2fb14-4ef3-4add-ac2b-55a0da929a17,2024-05-19 10:03:34+03:00,8,30472,3938,265,28,2879,1,501.611,0.0,0.0,0.0,50.943396226415096,0.0,9.421025901472829,0.0,9.421025901472829,33.443372270187915,0.0,0.0,0.0,0.0,0.0,0.0,0,0,332.64285714285717,299.96981132075473,142.3148806500762,0.663149048052888,0.5980128253183338,0.2837156295417688,1.0337597393605014,1.2062042279693381,0,135,1317,1,ВЫБРАЛИСЬ ИЗ  ПИЦЦЕРИИ ФРЕДДИ | КАК ПОБЕДИТЬ АНИМАТРОНИКОВ? Ч.2,"После того, как мы нашли тоннель и попали в другое отсек пиццеррии Фредди нам пришлось разгадать ещё несколько  загадок из ""5 ночей с Фредди"". По началу аниматроники пугали нас, но когда они стали добрыми, они нам помогли и мы с ними подружились.  Смотри, как с ними подружиться и выбраться из пиццерии Фредии, если вы туда зашли.  Приятного просмотра, мой юный друг.",Детям,3b2956e3-c9d3-4def-9e9e-37f6ad79bd43,367
d2a43178-4829-43d4-9b7c-295a44bde67c,2024-06-02 12:53:24+03:00,2,32975,6612,263,34,2667,1,361.963,0.0,0.0,0.0,45.247148288973385,0.0,1.5124016938898972,0.015124016938898971,1.3460375075620086,28.94736842105263,0.0,0.0,0.0,0.0,0.0,0.0,0,0,227.91176470588235,190.22053231939162,93.02873563218391,0.6296548672264357,0.5255247976157552,0.257011726701856,3.426484042257992,1.7733159041635551,0,119,1914,1,ИЗУЧАЕМ ДЕРЕВЬЯ | РАЗВИВАЮЩЕЕ ВИДЕО ДЛЯ ДЕТЕЙ,"РАЗВИВАЮЩЕЕ ВИДЕО для детей про деревья. Ребята узнают: названия деревьев, какую пользу несут деревья, познакомится с жучками на деревьях, узнает, из каких частей состоит дерево, про листья и шишки. Поговорим про виды деревьев: Лиственные деревья: береза, липа, дуб, клен, тополь, ива, осина, каштан, ясень. Хвойные деревья: ель, сосна, кедр, лиственница. Приятного просмотра.",Детям,3b2956e3-c9d3-4def-9e9e-37f6ad79bd43,376
f3d2e510-cf58-47cd-ad75-bbf65a37ee7d,2024-07-09 11:20:16+03:00,9,70589,64585,41412,10283,1469,1,366.6,0.01207379503525548,0.0024147590070510965,0.0024147590070510965,38.11938568530861,0.0,1.8332430130835333,0.0015483471394286599,1.7248587133235271,40.69520786560347,0.0046450414182859796,0.0,0.0,0.0,0.0,0.0,0,0,205.94009530292715,196.99700569883126,173.96804211504218,0.561756942997619,0.5373622632264901,0.4745445775096622,6.561679924597483,4.208400922765609,0,15786,26283,1,ИЗУЧАЕМ НАСЕКОМЫХ | ИЩЕМ НАСЕКОМЫХ В ГОРОДЕ,"В этом видео мы с Егориком решили отправиться на поиск насекомых в городской среде. Мы  будем учить названия насекомых и где они живут: бабочки, , муха, божья коровка, гусеница, жук, кузнечик, пчела, оса, шмель, паук. Приятного просмотра.",Детям,3b2956e3-c9d3-4def-9e9e-37f6ad79bd43,238
3d522f8e-f936-4262-b8b9-136b87151e50,2024-03-07 04:33:30+03:00,19,25118,54,16,3,2549,1,259.966,0.0,0.0,0.0,56.25,0.0,0.0,0.0,0.0,61.111111111111114,0.0,0.0,0.0,0.0,0.0,0.0,0,0,137.66666666666666,118.875,133.07407407407408,0.5295564291740714,0.4572713354823323,0.5118903013243042,1.3296532211026277,1.696999901439865,0,9,33,1,Изучаем космос // образовательные видео Valynha,"Приветствую всех, на своем канале! Тут вы потренируете свою фонтазию и внимательность, узнаете больше интересной информации с детским-образовательным контентом! На моем канале вы можете найти больше познавательных видео для вас и ваших детишек. Не забывайте ставить ракеты и подписывайтесь 💗 Так же можешь найти меня тут: Yappy: Valynha instagram: Valynha  email  Спасибо за ваш лайк!",Детям,f47e35ee-e1fb-4062-924d-076eec203b3f,384
f1862571-7b46-4d6a-a3dc-61e9ca9f8a00,2024-08-07 09:30:08+03:00,1,108696,108696,108696,18196,76,10,1522.092,0.06991977625671598,0.009199970560094207,0.0009199970560094208,39.40715389710753,0.0009199970560094208,0.06991977625671598,0.009199970560094207,0.0009199970560094208,39.40715389710753,0.0009199970560094208,0.0,0.0,0.0,0.0,0.0,0,0,540.0162123543636,577.0073691764186,577.0073691764186,0.3547855269946649,0.37908836599654855,0.37908836599654855,6.561679924597483,4.208400922765609,0,42834,42834,1,"Флора и Фортуна спасают рыбу от браконьера - Песенки Фортуны - Водичка, водица","Флора и Фортуна сегодня будут переплывать озеро на лодке. Но лодка не движется. Может, ей не даёт двигаться осьминог? Осьминоги не живут в таком водоёме! В воде много железок, девчонкам предстоит их достать и очистить воду. Ой, девочки попали в рыболовную сеть. Надо найти того, кто расставил рыболовную сеть. Это браконьер! Его нужно догнать и остановить! Получится ли это у Флоры и Фортуны. Подпишись на канал  , чтобы не пропустить ни одной серии любимых мультфильмов. Песенки Фортуны – это музыкальный мультсериал для самых маленьких зрителей и защитников природы. Малышка Фортуна и ее веселые песенки расскажут детишкам о простых правилах хорошего и доброго экоповедения. Мультсериал учит детей заботиться о природе и поднимает важные темы защиты экологии. #песенкифортуны #напомощь #защитаприроды",Детям,c3b25c9d-9cfb-4e86-8534-384452b157d3,802
c76e5b53-3f3b-485d-89d7-fbd415d4ea44,2024-08-06 09:30:07+03:00,0,108152,108152,108151,17847,39,4,1347.013,0.03606069292008396,0.003698532607188098,0.0,34.63121006740575,0.0,0.036060359494045416,0.003698498409645684,0.0,34.63088985871736,0.0,0.0,0.0,0.0,0.0,0.0,0,0,439.08511234381126,462.704404027702,462.7003291663585,0.32596946899830315,0.3435040374723199,0.34350101236317576,6.561679924597483,4.208400922765609,0,37454,37454,1,ЯРКИЙ ХИТ-ПАРАД - Песенки Фортуны - Любимые песенки,"Давайте споём все вместе самый яркий хит-парад. Раз-два-три, поём любимые песни, заряжаемся отличным настроением и помогаем природе. Подпишись на канал, чтобы не пропустить ни одной серии любимых мультфильмов. Песенки Фортуны – это музыкальный мультсериал для самых маленьких зрителей и защитников природы. Малышка Фортуна и ее веселые песенки расскажут детишкам о простых правилах хорошего и доброго экоповедения. Мультсериал учит детей заботиться о природе и поднимает важные темы защиты экологии. #песенкифортуны #песенки #яркийхитпарад",Детям,c3b25c9d-9cfb-4e86-8534-384452b157d3,539
f8552538-ac7c-47f9-9043-6732906b4d3f,2023-06-04 19:14:30+03:00,0,14154,1311,1228,330,2369,0,257.2,29.071661237785015,0.0,44.70684039087948,16.612377850162865,0.0,27.30739893211289,0.0,41.87643020594966,20.06102212051869,0.0,0.0,0.0,0.0,0.0,0.0,0,0,24.906060606060606,32.156351791530945,39.93592677345538,0.09683538338281729,0.12502469592352622,0.15527187703520753,6.561679924597483,4.208400922765609,0,204,263,1,Крутая игровая комната! & Сюрприз от Марио !,"Получив сообщение с просьбой о помощи от нашего друга Марио , мы не раздумывая отправились по тому адресу , что был указал в сообщении … Это была Крутая игровая комната, где мы просто потерялись в зонах развлечения … Где мы нашли Марио и что же случилось вы увидите в этой серии ! Честно - мы были в шоке 😨",Детям,4f9880ed-d43f-4129-bf5f-4634a11f5c28,306
8d917137-6800-4c3c-9a7e-238fa33e3c14,2023-11-18 16:19:21+03:00,6,31552,1147,973,299,2364,0,357.377,33.60739979445015,0.0,50.66803699897225,4.213771839671121,0.0,28.50915431560593,0.0,42.98169136878814,8.805579773321709,0.0,0.0,0.0,0.0,0.0,0.0,0,0,12.976588628762542,18.977389516957864,35.28334786399302,0.03631064290304788,0.053101877056883524,0.09872864751786775,2.1834514210783746,2.416910405123547,0,41,101,1,Батл! У кого игрушка круче ? 🤩,У каждого из нас разные интересы и мы решили устроить батл и выяснить чья игрушка круче 🫣 Для этого мы взяли конструктор и 3d ручку ! Что из этого получилось смотрите в этом ролике и пишите в комментариях какая игрушка вам понравилась больше 😉,Детям,4f9880ed-d43f-4129-bf5f-4634a11f5c28,243
f1d6389b-9a11-4bcf-adaf-8aa2ada24c61,2021-04-02 11:16:04+03:00,22,377190,111825,84462,17439,91,3,303.532,0.04262271790864531,0.0011839643863512585,0.00828775070445881,54.47301745163505,0.0035518931590537758,0.042029957522915266,0.000894254415381176,0.008942544153811759,55.8953722334004,0.0026827632461435278,0.0,0.0,0.0,0.0,0.0,0,0,206.32714031767875,202.89846321422652,195.93427230046947,0.6797541620576373,0.6684582291627458,0.6455143849757834,6.561679924597483,4.208400922765609,0,46009,62505,1,"Три кота, 1 сезон, 1 серия","«Три кота» — это история о повседневной жизни, отношениях и приключениях трех маленьких любознательных котят: Коржика, Компота и их младшей сестренки Карамельки. В их большой семье жизнь никогда не стоит на месте: вместе они учатся выражать свои эмоции, поддерживать друг друга и находить выход из любой, даже непростой на первый взгляд ситуации, при помощи своей фантазии и родительского совета.",Детям,b2cdb484-dacb-4cea-9906-7cb2c6571a23,396
2ac2accc-f3c8-4aeb-be7b-f7dacb347058,2024-08-07 09:02:08+03:00,1,99211,99211,99211,14295,69,4,712.0,0.06954873955508965,0.00403181098870085,0.010079527471752125,47.72857848424066,0.0010079527471752124,0.06954873955508965,0.00403181098870085,0.010079527471752125,47.72857848424066,0.0010079527471752124,0.0,0.0,0.0,0.0,0.0,0,0,291.94060860440715,342.0239388777454,342.0239388777454,0.41002894466911116,0.48037070067099075,0.48037070067099075,6.561679924597483,4.208400922765609,0,47352,47352,1,КАК ГОВОРЯТ ЖИВОТНЫЕ? Звуки животных для детей || Учим животных для самых маленьких,"Кто как говорит? Как называются звуки, издаваемые животными и как разговаривают домашние животные, дикие животные и птицы? Развивающих мультфильмов на нашем канале  - Как говорят животные для детей. Самые маленькие зрители узнают как говорят животные, и как это правильно называется. Учим звуки животных весело!  Мы постарались сделать наши мультфильмы красочными, простыми и добрыми. Очень надеемся, что они Вам понравятся!",Детям,68854e25-4de9-4c54-9fee-cde44626984e,424
